<?xml version="1.0" encoding="UTF-8"?>
<dataroot xmlns:od="urn:schemas-microsoft-com:officedata" xmlns:xsi="http://www.w3.org/2001/XMLSchema-instance"  xsi:noNamespaceSchemaLocation="PassiveTable.xsd" generated="2017-05-25T17:35:11">
<PassiveTable>
<ID>1</ID>
<PassiveName>1</PassiveName>
<PassiveType>1</PassiveType>
<Desc>축복</Desc>
<DeltaHP>1</DeltaHP>
<DeltaDamage>1</DeltaDamage>
<DeltaDef>1</DeltaDef>
<DeltaGold>0</DeltaGold>
<DeltaHunger>0</DeltaHunger>
<Count>10</Count>
</PassiveTable>
<PassiveTable>
<ID>2</ID>
<PassiveName>2</PassiveName>
<PassiveType>1</PassiveType>
<Desc>상처</Desc>
<DeltaHP>-1</DeltaHP>
<DeltaDamage>-1</DeltaDamage>
<DeltaDef>-1</DeltaDef>
<DeltaGold>0</DeltaGold>
<DeltaHunger>0</DeltaHunger>
<Count>5</Count>
</PassiveTable>
<PassiveTable>
<ID>3</ID>
<PassiveName>3</PassiveName>
<PassiveType>2</PassiveType>
<Desc>검</Desc>
<DeltaHP>0</DeltaHP>
<DeltaDamage>3</DeltaDamage>
<DeltaDef>0</DeltaDef>
<DeltaGold>0</DeltaGold>
<DeltaHunger>0</DeltaHunger>
<Count>5</Count>
</PassiveTable>
<PassiveTable>
<ID>4</ID>
<PassiveName>4</PassiveName>
<PassiveType>2</PassiveType>
<Desc>갑옷</Desc>
<DeltaHP>0</DeltaHP>
<DeltaDamage>0</DeltaDamage>
<DeltaDef>3</DeltaDef>
<DeltaGold>0</DeltaGold>
<DeltaHunger>0</DeltaHunger>
<Count>5</Count>
</PassiveTable>
<PassiveTable>
<ID>5</ID>
<PassiveName>5</PassiveName>
<PassiveType>3</PassiveType>
<Desc>힐링포션</Desc>
<DeltaHP>10</DeltaHP>
<DeltaDamage>0</DeltaDamage>
<DeltaDef>0</DeltaDef>
<DeltaGold>0</DeltaGold>
<DeltaHunger>0</DeltaHunger>
<Count>1</Count>
</PassiveTable>
<PassiveTable>
<ID>6</ID>
<PassiveName>6</PassiveName>
<PassiveType>3</PassiveType>
<Desc>빵</Desc>
<DeltaHP>0</DeltaHP>
<DeltaDamage>0</DeltaDamage>
<DeltaDef>0</DeltaDef>
<DeltaGold>0</DeltaGold>
<DeltaHunger>-10</DeltaHunger>
<Count>1</Count>
</PassiveTable>
<PassiveTable>
<ID>7</ID>
<PassiveName>7</PassiveName>
<PassiveType>4</PassiveType>
<Desc>코볼트고기</Desc>
<DeltaHP>0</DeltaHP>
<DeltaDamage>0</DeltaDamage>
<DeltaDef>0</DeltaDef>
<DeltaGold>20</DeltaGold>
<DeltaHunger>0</DeltaHunger>
<Count>1</Count>
</PassiveTable>
<PassiveTable>
<ID>8</ID>
<PassiveName>8</PassiveName>
<PassiveType>4</PassiveType>
<Desc>트롤고기</Desc>
<DeltaHP>0</DeltaHP>
<DeltaDamage>0</DeltaDamage>
<DeltaDef>0</DeltaDef>
<DeltaGold>100</DeltaGold>
<DeltaHunger>0</DeltaHunger>
<Count>1</Count>
</PassiveTable>
<PassiveTable>
<ID>9</ID>
<PassiveName>9</PassiveName>
<PassiveType>1</PassiveType>
<Desc>공포</Desc>
<DeltaHP>0</DeltaHP>
<DeltaDamage>-5</DeltaDamage>
<DeltaDef>-2</DeltaDef>
<DeltaGold>0</DeltaGold>
<DeltaHunger>0</DeltaHunger>
<Count>5</Count>
</PassiveTable>
<PassiveTable>
<ID>10</ID>
<PassiveName>10</PassiveName>
<PassiveType>2</PassiveType>
<Desc>브로드소드</Desc>
<DeltaHP>0</DeltaHP>
<DeltaDamage>5</DeltaDamage>
<DeltaDef>1</DeltaDef>
<DeltaGold>0</DeltaGold>
<DeltaHunger>0</DeltaHunger>
<Count>5</Count>
</PassiveTable>
<PassiveTable>
<ID>11</ID>
<PassiveName>11</PassiveName>
<PassiveType>2</PassiveType>
<Desc>체인매일</Desc>
<DeltaHP>0</DeltaHP>
<DeltaDamage>0</DeltaDamage>
<DeltaDef>5</DeltaDef>
<DeltaGold>0</DeltaGold>
<DeltaHunger>0</DeltaHunger>
<Count>5</Count>
</PassiveTable>
<PassiveTable>
<ID>12</ID>
<PassiveName>12</PassiveName>
<PassiveType>4</PassiveType>
<Desc>코볼트 피</Desc>
<DeltaHP>0</DeltaHP>
<DeltaDamage>0</DeltaDamage>
<DeltaDef>0</DeltaDef>
<DeltaGold>10</DeltaGold>
<DeltaHunger>0</DeltaHunger>
<Count>1</Count>
</PassiveTable>
<PassiveTable>
<ID>13</ID>
<PassiveName>13</PassiveName>
<PassiveType>3</PassiveType>
<Desc>신선한 물</Desc>
<DeltaHP>0</DeltaHP>
<DeltaDamage>0</DeltaDamage>
<DeltaDef>0</DeltaDef>
<DeltaGold>0</DeltaGold>
<DeltaHunger>-5</DeltaHunger>
<Count>0</Count>
</PassiveTable>
</dataroot>
